<?xml version = "1.0" encoding = "UTF-8" standalone = "no" ?>
<!DOCTYPE users SYSTEM 'user.dtd'>
<users>
    <user>
        <email>prueba</email>
        <name>prueba</name>
        <surname>prueba</surname>
        <pass>prueba</pass>
        <tasks>
            <task>
                <text>prueba</text>
                <list>main</list>
            </task>
            <task>
                <text>prueba</text>
                <list>main</list>
            </task>
            <task>
                <text>prueba</text>
                <list>main</list>
            </task>
            <task>
                <text>prueba</text>
                <list>main</list>
            </task>
            <task>
                <text>prueba</text>
                <list>main</list>
            </task>
            <task>
                <text>prueba</text>
                <list>main</list>
            </task>
            <task>
                <text>prueba</text>
                <list>main</list>
            </task>
            <task>
                <text>prueba</text>
                <list>main</list>
            </task>
            <task>
                <text>prueba</text>
                <list>main</list>
            </task>
            <task>
                <text>prueba</text>
                <list>main</list>
            </task>
            <task>
                <text>prueba</text>
                <list>main</list>
            </task>
            <task>
                <text>prueba</text>
                <list>main</list>
            </task>
        </tasks>
    </user>
</users>